url,title,snippet
https://afb.accuweather.com/blog/accuweather-gives-northeast-businesses-life-saving-advance-notice-on-multiple-tornadoes-flash-flooding,AccuWeather gives Northeast businesses life-saving advance notice ...,"Sep 15, 2023 ... September 13, 2023 - Eastern Connecticut and Rhode Island Tornadoes ... AccuWeather meteorologists issued a life-saving SkyGuard® Tornado Warning ..."
https://twitter.com/ryanhanrahan,Ryan Hanrahan (@ryanhanrahan) / X,"Chief Meteorologist at @NBCConnecticut - the NBC owned station in Hartford/New Haven, CT. Catch me M-F 4/5/6/11p. 🏳️‍"
https://weather.com/news/news/mayflower-vilonia-tornado-nws-warnings-save-lives-20140428,"Mayflower, Vilonia, Arkansas, Tornado: Timing of National Weather ...","Aug 26, 2015 ... Despite the tragic loss of life in Mayflower and Vilonia, Arkansas, lives were also undoubtedly saved by timely warnings."
https://wwmt.com/news/local/michigan-tornado-emergency-may-7-national-weather-service-recollection-warning-community-public-safety-weather-alert-branch-st-joseph-county-state,Meteorologist issues first-ever tornado emergency in Michigan ...,"Jun 4, 2024 ... This includes the meteorologists at the National Weather Service, who issued warnings and relayed life saving information. In the days ..."
https://www.accuweather.com/en/weather-forecasts/accuweathers-superior-accuracyonce-again-saves-lives-as-severe-weather-sweeps-across-the-central-us/1646633,AccuWeather's Superior Accuracy™once again saves lives as ...,"... life-saving SkyGuard® Tornado Warnings, which in ... AccuWeather SkyGuard® Severe Weather Warning Service protects people and facilities in emergencies ..."
https://www.cnn.com/2019/05/29/us/weather-alert-tech-saved-lives-trnd/index.html,Phone alerts by phone likely saved lives during the multiple late ...,"May 29, 2019 ... Since 2012, the Wireless Emergency Alerts system has sent out more ... The system sends out alerts for tsunami warnings, tornado and flash flood ..."
https://www.csmonitor.com/USA/Latest-News-Wires/2012/0415/Tornado-watch-Early-warnings-may-have-saved-Iowa-town,Tornado watch: Early warnings may have saved Iowa town ...,"Apr 15, 2012 ... Residents credited early warnings with saving lives. |. Gene Blevins/Reuters. Storm chaser photographer Brad Mack shoots a tornado as it makes ..."
https://www.denver7.com/news/national/during-late-night-storms-phone-alerts-are-saving-lives,"During late night storms, phone alerts are saving lives","May 29, 2019 ... The system sends out alerts for tsunami warnings, tornado and flash flood warnings, as well as hurricane, typhoon, storm surge, and extreme wind ..."
https://www.foxweather.com/weather-news/south-southeast-flooding-severe-weather-january-2024,"Flash Flood Warnings issued across South, Gulf Coast on ...","Jan 23, 2024 ... FLOOD WATCH, WARNING AND EMERGENCY: HERE ARE THE DIFFERENCES THAT COULD SAVE YOUR LIFE. Flash flood risk expands along Gulf Coast. The flash ..."
https://www.govtech.com/em/hilary-wasnt-unprecedented-but-warnings-saved-lives,Hilary Wasn't Unprecedented but Warnings Saved Lives,"Aug 28, 2023 ... ... life-threatening and catastrophic flooding from heavy rains, especially in the mountains and deserts. Officials issued the region's first ..."
https://www.govtech.com/em/safety/Illinoois-Tornado-Warning.html,Illinois Officials Credit Early Tornado Warning Tech for Saving Lives,"Jun 30, 2016 ... Weather radios bleep their warnings; television programs are interrupted with emergency alerts; cellphones ring with weather-service news."
https://www.nbcnews.com/news/us-news/alabama-tornadoes-how-lessons-deadly-2011-outbreak-helps-save-lives-n979526,Alabama tornadoes: How lessons from deadly 2011 outbreak that ...,"Mar 5, 2019 ... During a news conference Monday, Lee County Emergency Management Director Kathy Carson said she was “pretty sure” the sirens sounded warnings ..."
https://www.noaa.gov/stories/better-wireless-emergency-alerts-coming-to-cell-phone-near-you,Better wireless emergency alerts coming to a cell phone near you ...,"Feb 19, 2020 ... These jolting alarms coupled with vibration and text-like messages are Wireless Emergency Alerts (WEAs) — and they're saving lives. WEAs ..."
https://www.sacbee.com/news/local/article265516151.html,California heat wave emergency alerts saved lives | Sacramento Bee,"Sep 10, 2022 ... The recent Natomas High School graduate, who is nonverbal and could not be interviewed prior to publication, likes to meet dogs and watch birds ..."
https://www.sciencedirect.com/science/article/pii/S2212095522003108,"Urban extreme heat, climate change, and saving lives: Lessons from ...",... temperature to provide early warning of heat strain symptoms. 3.5. Improve ... save a life during a heat emergency. Such a redundant portfolio approach ...
https://www.timesleaderonline.com/uncategorized/2019/05/alarms-may-have-saved-lives/,"Alarms may have saved lives | News, Sports, Jobs - The Times Leader","May 29, 2019 ... ... Idaho and Colorado. Tornado warnings stretched as far east as New York City and the National Weather Service confirmed a touchdown in ..."
https://www.washingtonpost.com/weather/2021/04/01/alabama-tornado-warnings-saved-lives/,Alabama tornado disaster highlights how warnings save lives - The ...,"Apr 1, 2021 ... Here's how tornado warnings saved lives last week in Alabama. The ... There were also significant efforts by the media and emergency ..."
https://www.washingtonpost.com/weather/2023/10/04/wireless-emergency-alerts-weather-phones/,"Emergency phone alerts have saved lives, and caused confusion ...","Oct 4, 2023 ... ... alert as Hurricane Hilary approached California. Advertisement. Story continues below advertisement. Several tests of the system have gone ..."
https://www.washingtonpost.com/weather/2023/10/04/wireless-emergency-alerts-weather-phones/,"Emergency phone alerts have saved lives, and caused confusion ...","Oct 4, 2023 ... ... alert as Hurricane Hilary approached California. ... Previously, it would issue a wireless alert for every flash flood warning ..."